{
  "settingId": "spuk_im_schlosskeller",
  "bereich": "befragung",
  "hinweis": "Befragungen des Detektivs, Runde 2 (A-051): Thema, Fragen und eigene Würze je Rolle. Die Antwort entsteht nur aus der Preisgabe.",
  "eintraege": [
    {
      "id": "bf_ahmet_2",
      "rolle": "ahmet",
      "runde": 2,
      "thema": "Theke und Geld",
      "fragen": [
        "Was hast du an der Theke gesucht?",
        "Wofür war das eingesammelte Geld?"
      ],
      "stichpunkte": [
        "Ich bleib bei dem, was ich gesagt hab."
      ],
      "preisgabe": [
        "luege:luege_ahmet_servietten",
        "luege:luege_ahmet_miete"
      ]
    },
    {
      "id": "bf_fatma_2",
      "rolle": "fatma",
      "runde": 2,
      "thema": "Was du bei dir trägst",
      "fragen": [
        "Was trägst du in deiner Tasche herum?",
        "Bleibst du dabei, wo du gestanden hast?"
      ],
      "stichpunkte": [
        "Ich hab nichts zu verbergen."
      ],
      "preisgabe": [
        "luege:luege_fatma_tasche",
        "luege:luege_fatma_buffet"
      ]
    },
    {
      "id": "bf_olli_2",
      "rolle": "olli",
      "runde": 2,
      "thema": "Der Tisch im Ost-Saal",
      "fragen": [
        "Bist du wirklich die ganze Zeit sitzen geblieben?",
        "Was hast du im Dunkeln gehört?"
      ],
      "stichpunkte": [
        "Im Dunkeln sieht man kaum die Hand."
      ],
      "preisgabe": [
        "luege:luege_olli_tafel"
      ]
    },
    {
      "id": "bf_can_2",
      "rolle": "can",
      "runde": 2,
      "thema": "Das leuchtende Gesicht",
      "fragen": [
        "Was weißt du über das leuchtende Gesicht?",
        "Wann bist du in den Turm gegangen?"
      ],
      "stichpunkte": [
        "Ich mach gern Späße, aber nicht heute."
      ],
      "preisgabe": [
        "luege:luege_can_maske",
        "luege:luege_can_toilette"
      ]
    },
    {
      "id": "bf_leyla_2",
      "rolle": "leyla",
      "runde": 2,
      "thema": "Kurz vor zwölf an der Theke",
      "fragen": [
        "Was hast du kurz vor zwölf an der Theke bemerkt?",
        "Hatte jemand etwas in der Hand?"
      ],
      "stichpunkte": [
        "Ahmet ist mein Cousin, ich mag ihn."
      ],
      "preisgabe": [
        "beobachtung:b_lejla_ahmet_theke"
      ]
    },
    {
      "id": "bf_emine_2",
      "rolle": "emine",
      "runde": 2,
      "thema": "Am linken Buffettisch",
      "fragen": [
        "Wie lange bist du dort geblieben?",
        "Wer war im Dunkeln neben dir?"
      ],
      "stichpunkte": [
        "Ich unterrichte Grundschulkinder, ich bleib ruhig."
      ],
      "preisgabe": [
        "beobachtung:b_emine_versteck"
      ]
    },
    {
      "id": "bf_tim_2",
      "rolle": "tim",
      "runde": 2,
      "thema": "Der Stromausfall",
      "fragen": [
        "Weißt du, warum das Licht ausging?",
        "Wohin bist du im Dunkeln gegangen?"
      ],
      "stichpunkte": [
        "Alte Leitungen machen mir nichts vor."
      ],
      "preisgabe": [
        "beobachtung:b_tim_gesicht"
      ]
    },
    {
      "id": "bf_johanna_2",
      "rolle": "johanna",
      "runde": 2,
      "thema": "Die Fotos von heute",
      "fragen": [
        "Zeigst du mir deine Fotos von heute?",
        "Was war vor dem Knall an der Theke los?"
      ],
      "stichpunkte": [
        "Meine Fotos zeige ich nicht jedem."
      ],
      "preisgabe": []
    },
    {
      "id": "bf_murat_2",
      "rolle": "murat",
      "runde": 2,
      "thema": "Etwas Seltsames im Dunkeln",
      "fragen": [
        "Hast du im Dunkeln etwas Seltsames gesehen?",
        "In welche Richtung lief es?"
      ],
      "stichpunkte": [
        "Ich hab gute Augen, auch im Dunkeln."
      ],
      "preisgabe": [
        "beobachtung:b_marek_gesicht"
      ]
    },
    {
      "id": "bf_zeynep_2",
      "rolle": "zeynep",
      "runde": 2,
      "thema": "Was im Dunkeln vorbeikam",
      "fragen": [
        "Woher kam das, was du gesehen hast?",
        "Wo ist dein Bruder gewesen?"
      ],
      "stichpunkte": [
        "Mein Bruder macht oft Quatsch."
      ],
      "preisgabe": [
        "beobachtung:b_zeynep_gesicht"
      ]
    },
    {
      "id": "bf_baran_2",
      "rolle": "baran",
      "runde": 2,
      "thema": "Die Rufe",
      "fragen": [
        "In welcher Reihenfolge kamen die Geräusche?",
        "Woher kamen die Rufe?"
      ],
      "stichpunkte": [
        "Ich hab ein gutes Ohr für Töne."
      ],
      "preisgabe": [
        "beobachtung:b_baran_rufe"
      ]
    },
    {
      "id": "bf_meryem_2",
      "rolle": "meryem",
      "runde": 2,
      "thema": "Kurz nach zwölf",
      "fragen": [
        "Was hast du kurz nach zwölf am Kamin gesehen?",
        "Wer kam in deine Nähe?"
      ],
      "stichpunkte": [
        "Der Ruß an meinen Händen ist vom Kamin."
      ],
      "preisgabe": [
        "beobachtung:b_hana_umschlag"
      ]
    },
    {
      "id": "bf_serkan_2",
      "rolle": "serkan",
      "runde": 2,
      "thema": "Das Außentor",
      "fragen": [
        "War das Tor die ganze Zeit zu?",
        "Wer kam in deine Nähe?"
      ],
      "stichpunkte": [
        "Meine Taschenlampe hab ich immer dabei."
      ],
      "preisgabe": [
        "beobachtung:b_serkan_tor"
      ]
    },
    {
      "id": "bf_aylin_2",
      "rolle": "aylin",
      "runde": 2,
      "thema": "Die Miete",
      "fragen": [
        "Was weißt du über die Miete für den Keller?",
        "Wer hat das Geld eingesammelt?"
      ],
      "stichpunkte": [
        "Zahlen lügen nicht."
      ],
      "preisgabe": [
        "beobachtung:b_aylin_quittung"
      ]
    },
    {
      "id": "bf_kaan_2",
      "rolle": "kaan",
      "runde": 2,
      "thema": "Wer an dir vorbeikam",
      "fragen": [
        "Wer ist im Dunkeln an dir vorbei?",
        "Mit wem hast du vor dem Knall geredet?"
      ],
      "stichpunkte": [
        "Ich studiere Architektur, ich schau genau hin."
      ],
      "preisgabe": [
        "beobachtung:b_wojtek_olli_satz",
        "beobachtung:b_wojtek_vorbei"
      ]
    },
    {
      "id": "bf_dilara_2",
      "rolle": "dilara",
      "runde": 2,
      "thema": "Was dir aufgefallen ist",
      "fragen": [
        "Was hast du vor dem Knall bemerkt?",
        "Wessen Sachen sahen seltsam aus?"
      ],
      "stichpunkte": [
        "Auf Flohmärkten lernt man genau hinzusehen."
      ],
      "preisgabe": [
        "beobachtung:b_azra_tasche"
      ]
    },
    {
      "id": "bf_enes_2",
      "rolle": "enes",
      "runde": 2,
      "thema": "Die Theke vor dem Knall",
      "fragen": [
        "Wer stand an der Theke?",
        "Wer fehlte dort?"
      ],
      "stichpunkte": [
        "Mit Kindern lernt man, genau hinzuschauen."
      ],
      "preisgabe": [
        "beobachtung:b_damir_an_der_theke"
      ]
    },
    {
      "id": "bf_selin_2",
      "rolle": "selin",
      "runde": 2,
      "thema": "Was du gesehen hast",
      "fragen": [
        "Wohin ist das, was du gesehen hast, gelaufen?",
        "Hat es Geräusche gemacht?"
      ],
      "stichpunkte": [
        "Ich zieh bei Lärm die Schultern hoch."
      ],
      "preisgabe": [
        "beobachtung:b_selin_gesicht"
      ]
    },
    {
      "id": "bf_hakan_2",
      "rolle": "hakan",
      "runde": 2,
      "thema": "Herr Schneider und die Stiftung",
      "fragen": [
        "Warum ist Herr Schneider beim Geld so streng?",
        "Mit wem hatte er heute Ärger?"
      ],
      "stichpunkte": [
        "Ich will Herrn Schneider in Schutz nehmen."
      ],
      "preisgabe": [
        "beobachtung:b_pawel_schneider"
      ]
    },
    {
      "id": "bf_tugba_2",
      "rolle": "tugba",
      "runde": 2,
      "thema": "Die Liste",
      "fragen": [
        "Wer fehlte kurz vor dem Knall?",
        "Wo waren die Leute angeblich?"
      ],
      "stichpunkte": [
        "Ich plane alles mit Ablaufplan."
      ],
      "preisgabe": [
        "beobachtung:b_tugba_notiz"
      ]
    }
  ]
}
